Nombre,Direccion,Telefono,Web,Email,Sector,Ubicacion
Centro Estético En Madrid - Marta Aguayo,"C. de García Luna, 2, Chamartín, 28002 Madrid",+34 915 64 61 28,http://www.esteticamartaaguayo.com/,esteticamartaaguayo@gmail.com,estetica,Madrid
Soy Clínica Estética,"Calle del Príncipe de Vergara, 67, Salamanca, 28006 Madrid",+34 722 55 21 95,http://www.soymedicinaestetica.com/,info@soymedicinaestetica.com,estetica,Madrid
Clinica estética en Madrid - VenusMed,"C. de Narváez, 65, Retiro, 28009 Madrid",+34 613 05 34 06,https://venusmed.clinic/,info@venusmed.clinic,estetica,Madrid
Eternal Beauty Clínica,"Calle del Príncipe de Vergara, 287, Chamartín, 28016 Madrid",+34 678 04 84 01,https://www.eternalbeautyclinic.com/eternal-beauty-clinic-principe-de-vergara-287/?utm_source=contacto&utm_medium=gmb,pv@eternalbeautyclinic.com,estetica,Madrid
Clínica Trevi | Medicina Estética en Madrid,"C. de Apolonio Morales, 21A, Chamartín, 28036 Madrid",+34 692 82 10 47,https://www.clinicatrevi.com/,n@clinicatrevi.com,estetica,Madrid
Estética y Osteopatía Osteoestétic Angélica Castillo,"Calle del Príncipe de Vergara, 268, 1ºA, Chamartín, 28016 Madrid",+34 660 21 05 33,http://www.osteoestetic.es/,,estetica,Madrid
Clínica Estética Madrid Centro SAPPHIRA PRIVÉ,"C. de las Dos Hermanas, 16, Centro, 28012 Madrid",+34 919 35 01 14,https://clinicaesteticamadridcentro.com/?utm_source=google&utm_medium=organic&utm_campaign=googlemaps&utm_id=clinicaesteticamadridcentro,info@clinicaesteticamadridcentro.com,estetica,Madrid
Clinica Lotus - Medicina Estética en Madrid,"C. de López de Hoyos, 133, Chamartín, 28002 Madrid",+34 619 72 40 09,http://clinicalotus.es/,,estetica,Madrid
Madrid Clínica Estética Dra. Esperanza Sapeg,"C. de Luis Cabrera, 92, Chamartín, 28002 Madrid",+34 675 37 70 97,,,estetica,Madrid
Amarán Estética,"C. de Blasco de Garay, 41, Chamberí, 28015 Madrid",+34 638 40 57 46,https://www.amaranestetica.es/,hola@amaranestetica.es,estetica,Madrid
Anna Vazquez Skin Care,"Cl. de Ayala, 117, Salamanca, 28009 Madrid",,https://www.annavazquezskincare.com/,,estetica,Madrid
Centro de Estética Madrid Ángela Gómez EDLM,"C/ de la Estrella Polar, 13, Retiro, 28007 Madrid",+34 673 87 54 40,https://esteticadelamirada.es/,info@esteticadelamirada.es,estetica,Madrid
Dra. Fercasy,"Calle Velázquez, 73, bajo c, Salamanca, 28006 Madrid",+34 910 27 48 53,https://fercasy.com/,clinica@fercasy.com,estetica,Madrid
AESTHETIC MADRID GOYA,"Calle de Goya, 139, Salamanca, 28009 Madrid",+34 640 32 19 45,http://www.aestheticmadrid.com/,,estetica,Madrid
Clínica de Medicina Estética en Madrid | Durando,"C. Alcalá, 295, 1D, Cdad. Lineal, 28027 Madrid",+34 642 95 67 06,http://www.durandomedicinaestetica.com/,durandomedicinaestetica@gmail.com,estetica,Madrid
Clinica Medicina Estética,"Pl. de Matute, 5, Centro, 28012 Madrid",+34 676 71 74 24,https://femsiebelleza.com/,%20femsiebelleza@gmail.com,estetica,Madrid
Centro De Estetica Maria Rosa,"C. de Nieremberg, 1, Local, Chamartín, 28002 Madrid",+34 619 42 04 64,,,estetica,Madrid
Estética Him and Her Madrid,"C. de Canillas, 4, Chamartín, 28002 Madrid",+34 658 07 48 79,http://www.esteticahimandher.es/,estetica.himandher@gmail.com,estetica,Madrid
Spalook,"C. de Colombia, 18, Chamartín, 28016 Madrid",+34 622 24 72 17,https://spalookrituals.com/,spalookgerencia@gmail.com,estetica,Madrid
Clínica Medicina Estética Dra. Elena Berezo | Madrid,"Calle Velázquez, 115, Local Bajo Izquierda, Salamanca, 28006 Madrid",+34 695 61 13 61,https://drelenaberezo.com/?utm_source=google&utm_medium=GMB&utm_campaign=boton_sitioweb&utm_term=google_my-business,info@drelenaberezo.com,estetica,Madrid
Felicidad Carrera Centro de Estética,"Calle de Castelló, 67, Salamanca, 28001 Madrid",+34 914 35 17 24,https://felicidadcarrera.com/,dpo@felicidadcarrera.com,estetica,Madrid
Bienestar Chic,"C. del Aviador Zorita, nº46, Tetuán, 28020 Madrid",+34 915 79 96 17,https://centroesteticamadrid-chic.com.es/,,estetica,Madrid
The Look Madrid Centro de estética,"C. de Menéndez Pidal, 32, Bajo B, Chamartín, 28036 Madrid",+34 617 73 41 44,https://thelookmadrid.com/,,estetica,Madrid
INSTITUTO MEDICINA ESTÉTICA | IME,"C. de Vallehermoso, 9, Chamberí, 28015 Madrid",+34 623 51 23 38,https://institutomedicinaestetica.com/,info@institutomedicinaestetica.com,estetica,Madrid
Clínica Esvital,"C. de López de Hoyos, 15, 1 Centro, Salamanca, 28006 Madrid",+34 690 91 82 00,https://clinicaesvital.com/,contacto@clinicaesvital.com,estetica,Madrid
Raizen Estética Avanzada,"Cam. de Canillas, 32, Salamanca, 28028 Madrid",+34 635 13 09 73,,,estetica,Madrid
The Secret Lab - Centro de estética Madrid,"Calle de Zurbano, 4, Bajo izquierda, Chamberí, 28010 Madrid",+34 910 29 11 59,https://thesecretlab.es/,info@thesecretlab.es,estetica,Madrid
"Mangata - Centro de Estética Integral,Medicina Estética y Fisioterapia","C. de Víctor Andrés Belaunde, 6, Chamartín, 28016 Madrid",+34 622 83 48 36,https://www.mangataestetica.com/,,estetica,Madrid
MONICA RUIZ CENTRO ESTÉTICO,"C/ de Feijóo, 8, Chamberí, 28010 Madrid",+34 683 37 58 12,https://monicaruizesteticachamberi.es/,monicaruizcentroestetico8@gmail.com,estetica,Madrid
Edyta Beauty Madrid - Centro de Estética en Castillejos,"C. de Orense, 33, Tetuán, 28020 Madrid",+34 616 85 67 79,https://edytabeauty.net/,edytabeauty@gmail.com,estetica,Madrid
Clinique Beauté - Centro De Belleza,"C. de Ríos Rosas, 39, Chamberí, 28003 Madrid",+34 644 74 71 66,http://www.cliniquebeaute.es/,info@cliniquebeaute.es,estetica,Madrid
Chanel Elizalde centro estético,"C. de la Drácena, 15, Chamartín, 28016 Madrid",+34 605 58 98 96,http://instagram.com/bychanelelizalde,,estetica,Madrid
Estética Iris Madrid,"Calle del Dr. Fleming, 60, A, Chamartín, 28036 Madrid",+34 630 33 04 03,https://www.esteticairismadrid.es/,info@esteticairismadrid.es,estetica,Madrid
"Eternal Beauty Clinic - Centro de estética, medicina estética y depilación láser","Av. del General Perón, 32, Tetuán, 28020 Madrid",+34 912 42 34 00,https://www.eternalbeautyclinic.com/eternal-beauty-clinic-general-peron-32/?utm_source=contacto&utm_medium=gmb,gp@eternalbeautyclinic.com,estetica,Madrid
"Top Sun and Beauty / Centro de estética y bronceado. INDIBA, LPG, LÁSER SHR, ELÉCTRICA","Av. de América, 12, Salamanca, 28028 Madrid",+34 640 63 22 23,http://www.topsunandbeauty.es/,,estetica,Madrid
Montserrat Quirós,"C. de Luis de Salazar, 16, Chamartín, 28002 Madrid",+34 915 15 30 66,https://www.montserratquiros.es/,mq@montserratquiros.es,estetica,Madrid
Centro estético Madrid | INDIBA | KOAKAI,"Calle Gurtubay, 8 (Esquina, Calle Velázquez, 17, Salamanca, 28001 Madrid",+34 910 58 24 84,https://www.koakaispain.com/,,estetica,Madrid
The Beauty Concept Chile,"C. de Chile, 10, Chamartín, 28016 Madrid",+34 914 57 25 31,https://thebeautyconcept.com/tbc-chile-10/,tbcchile@thebeautyconcept.com,estetica,Madrid
Estéticas Contigo,"Av. de Badajoz, 3, local 2A, Cdad. Lineal, 28027 Madrid",+34 642 04 30 02,https://esteticascontigo.com/,hi@typemade.mx,estetica,Madrid
Centro Miriam Moreno,"Calle de Zurbano, 22, Chamberí, 28010 Madrid",+34 640 24 83 47,https://miriamclinic.es/,info@miriamclinic.es,estetica,Madrid
Clínica Estética Nazaret,"C. de Rosario Pino, 18, 1º, Puerta 1, Tetuán, 28020 Madrid",+34 914 17 85 56,http://www.clinicanazaret.com/,info@clinicanazaret.com,estetica,Madrid
"IN MADRID , CENTRO De Belleza y Bienestar","C. de Fortunata y Jacinta, 12, Tetuán, 28020 Madrid",+34 910 34 99 67,https://sites.google.com/view/inmadrid/inicio,,estetica,Madrid
Carmen Ortega Estética INDIBA®,"C. del Pez Austral, 12, Retiro, 28007 Madrid",+34 616 66 15 73,https://carmenortegaindiba.es/,info@carmenortegaindiba.es,estetica,Madrid
Cristina Herraiz Centro de Estética,"C/ de Agustín de Betancourt, 7, Chamberí, 28003 Madrid",+34 915 33 10 85,http://www.cristinaherraiz.com/,,estetica,Madrid
Centro de Estética Merche,"Av. de Alberto Alcocer, 47, Local 14, Chamartín, 28016 Madrid",+34 608 20 00 09,https://chatwith.io/es/instagram/centro-de-estetica-merche,,estetica,Madrid
María Rodríguez Estética Avanzada,"C. de Cristóbal Bordiú, 41, Chamberí, 28003 Madrid",+34 686 02 38 76,http://mariarodriguezestetica.com/,,estetica,Madrid
Claudia Ramos Beauty,"C. de Orense, 12, Tetuán, 28020 Madrid",+34 627 07 54 91,,,estetica,Madrid
Baobá Belleza,"Metro Plaza España, C. de Juan Álvarez Mendizábal, 3, Moncloa - Aravaca, 28008 Madrid",+34 910 09 77 62,http://www.baobabelleza.com/,baoba@baobabelleza.com,estetica,Madrid
Colora Estetica,"P.º de la Castellana, 192, Chamartín, 28046 Madrid",+34 658 43 63 55,,,estetica,Madrid
Centro de Estética Madrid - Chamberí | Violette La Chambérienne,"C. de Bravo Murillo, 9, Chamberí, 28015 Madrid",+34 649 21 89 24,https://violettelc.com/?utm_source=google&utm_medium=maps&utm_campaign=My%20Business,,estetica,Madrid
Marcy Coutinho Estética Personalizada - Centro de Estética,"Av. de Alberto Alcocer, 48, Chamartín, 28016 Madrid",+34 711 78 55 02,,,estetica,Madrid
Carolina Londoño Estética,"Calle Emilio Ferrari 109, C. de Emilio Ferrari, 103, Cdad. Lineal, 28017 Madrid",+34 615 05 08 05,http://www.carolinalondonoestetica.com/,,estetica,Madrid
Brenton Clinic,"C de Víctor de la Serna, 16, Local, Chamartín, 28016 Madrid",+34 910 39 05 37,http://www.brentonclinic.com/,info@brentonclinic.com,estetica,Madrid
Hera Beauty - Estética Avanzada,"C. Marqués de la Valdavia, 3, Arganzuela, 28012 Madrid",+34 696 46 86 85,http://www.herabeauty.es/,info@herabeauty.es,estetica,Madrid
Centro de Estética Carmen Navarro M. Esquinza,"C. del Monte Esquinza, 11, Chamberí, 28010 Madrid",+34 914 49 55 28,https://carmennavarro.com/,,estetica,Madrid
Clínica Robega | Medicina Estética,"Plaza de España 14D, Esquina, C. de Juan Álvarez Mendizábal, 1, Moncloa - Aravaca, 28008 Madrid",+34 627 08 80 47,https://www.clinicarobega.com/,,estetica,Madrid
Centro Médico Estético ARGANZUELA,"C. de Bolívar, 26, Arganzuela, 28045 Madrid",+34 914 68 21 73,http://www.centromedicoesteticoarganzuela.es/,,estetica,Madrid
MyEstetic Centro Médico Estético,"C/ de Querol, 8, Cdad. Lineal, 28033 Madrid",+34 657 43 38 55,http://myestetic.com/,info@myestetic.com,estetica,Madrid
Clínica Estética ASISA CARE + LÁSER,"C. de Edgar Neville, 18, Tetuán, 28020 Madrid",+34 919 01 02 56,https://asisacare.es/centro/care-madrid-2/,,estetica,Madrid
Clinicas Novastetic,"C. del Espíritu Santo, 2, Centro, 28004 Madrid",+34 634 70 09 39,https://clinicasnovastetic.com/,spa-icon-dark-01@2x.png,estetica,Madrid
